,tweet_id,UserScreenName,UserName,names,nouns,verbs,cardinal_digit,orginal_tweet,Likes,Retweets,Image_link,text_clean,sentiments_vds
0,0,Murad Saeed,@MuradSaeedPTI,[برف پگھل],"['ہے', 'پگھل', 'چکی']",[],[],برف پگھل چکی ہے!,"6,530",17.4K,[],,neu
1,1,Mirza Khan,@MirzaKhan_PTI,"[رہی ہے 
]","['چوروں_کا_ایک_سال', 'خود', 'کو', 'دہرا', 'رہی', 'ہے', '@', 'TeamiPians']",[],[],"تاریخ خود کو دہرا رہی ہے 
@TeamiPians
 
#چوروں_کا_ایک_سال","1,372","2,583",[],,neu
2,2,Muhammad Khalid Khurshid Khan,@AbdulKhalidPTI,"[خورشید کی صوبائی وزراء, ، مقبوضہ]","['آباد', 'کانفرنس', 'کا…', 'اعلیٰ', 'گلگت', 'بلتستان', 'خالد', 'خورشید', 'کی', 'صوبائی', 'وزراء', 'کے', 'ہمراہ', 'اہم', 'پریس', 'موقع', 'پر', 'گفتگو', 'کرتے', 'ہوئے', 'وزیراعلیٰ', 'نے', 'کہا', 'کہ', 'بھارت', 'مقبوضہ', 'کشمیر', 'میں', 'حوالے', 'سے', 'کروا', 'رہا', 'ہے', 'اس', 'ہمارے', 'دوست', 'ممالک', 'بھی', 'شامل', 'ہیں،', 'جموں', 'و']",['جی'],['20'],"اسلام آباد: وزیر اعلیٰ گلگت  بلتستان خالد خورشید کی صوبائی وزراء کے ہمراہ  اہم پریس کانفرنس! 

 اس موقع پر گفتگو کرتے ہوئے وزیراعلیٰ گلگت بلتستان نے کہا  کہ بھارت مقبوضہ کشمیر میں جی 20 کے حوالے سے کانفرنس کروا رہا ہے اس میں ہمارے دوست ممالک بھی  شامل ہیں، مقبوضہ جموں و کشمیر کا…","2,868",11K,"['https://pbs.twimg.com/media/FtclLdJWwAAY2Bm?format=jpg&name=small', 'https://pbs.twimg.com/media/FtclLw8XgAIQlPX?format=jpg&name=small']",20,neu
3,3,Rahman Wazir,@PTIUpdatess,[Asim Munir],"['progress', 'projects', 'developments', 'defence', 'production', 'capabilities', 'COAS', 'Gen', 'Asim', 'Munir', 'Heavy', 'Industries', 'Taxila', 'HIT', 'Army', 'Chief', 'Pakistan']","['visited', 'briefed', 'ongoing']",[],"COAS Gen Asim Munir visited the Heavy Industries Taxila (HIT), where he was briefed on the progress of ongoing projects and the latest developments in defence production. Army Chief was briefed on the technical capabilities of the HIT, the progress of ongoing projects.

#Pakistan",12,45,['https://pbs.twimg.com/ext_tw_video_thumb/1645844405667115009/pu/img/RodpL_uy1OZPt0ji.jpg'],coas gen asim munir visited the heavy industries taxila hit where he was briefed on the progress of ongoing projects and the latest developments in defence production army chief was briefed on the technical capabilities of the hit the progress of ongoing projects pakistan,pos
4,4,Muneeb Ullah,@MuneebUllahPTI,[],"['dinner', 'team', 'Iftaar', 'Media', 'Management', 'Cell', 'Lahore', 'LahoreKaptaanKa']",[],['1st'],"Iftaar dinner on the 1st anniversary or Media Management Cell Lahore team.
#LahoreKaptaanKa",23,95,"['https://pbs.twimg.com/media/Ftbo16eaMAAezU_?format=jpg&name=small', 'https://pbs.twimg.com/media/Ftbo2PMaUAAGKDD?format=jpg&name=small']",iftaar dinner on the 1st anniversary or media management cell lahore team lahorekaptaanka,neu
